,枠,馬番,馬名,性齢,斤量,騎手,厩舎,所属,horse_id,jockey_id,父,母,母父,score,rank
0,1,1,メイショウコナン,牡3,56.0,団野,荒川,栗東,2021103064,01180,ロジャーバローズ ,ケイティーズミスト ,Posse ,-0.11164801176630877,5
1,2,2,ウォーターハウス,牡4,58.0,西村淳,高野,栗東,2020102664,01171,ロードカナロア ,ショウナンパンドラ ,ディープインパクト ,0.05853680153076791,4
2,3,3,シャンデルナゴル,牡4,58.0,Ｃデムーロ,石坂,栗東,2020103193,05473,サトノダイヤモンド ,アガルタ ,キングカメハメハ ,1.996372100601756,3
3,4,4,ホルトバージ,牡3,56.0,武豊,寺島,栗東,2021102905,00666,キンシャサノキセキ ,プレインズウーマン Plainswoman(亜) ,Zensational ,2.8753774990893293,1
4,5,5,リワードファラオン,牡3,54.0,◇永島,村田,美浦,2021103385,01187,スマートファルコン ,リワードクリエン ,ケイムホーム Came Home(米) ,-2.353810181664291,6
5,6,6,アマートカヴァロ,牡4,56.0,△高杉,笹田,栗東,2020103754,01213,サトノクラウン ,ペルサントクリール ,Point Given (米) ,-4.5225348014255795,8
6,7,7,キングリスティア,セ8,54.0,★河原田,河内,栗東,2016106594,01204,ベルシャザール ,リスティアアスリー ,スピニングワールド Spinning World(米) ,-5.7611379253763415,9
7,8,8,スノーライトニング,牡3,54.0,△吉村,松下,栗東,2021105828,01216,レイデオロ ,ライトファンタジア ,ゼンノロブロイ ,-4.441811566725656,7
8,8,9,ジュンラトゥール,牡3,56.0,松山,浜田,栗東,2021104039,01126,パイロ Pyro(米) ,グーテデロワ ,スペシャルウィーク ,2.1474615616168844,2
